{
  "artifact_type": "aic_behavior_proof",
  "contract": {
    "digest": "sha256:6f809e4782bf1f1cffcfc8815ec649fa562fc875cc032b8f9145b6b7539cbd4f",
    "id": "checkout.complete.behavior",
    "spec": "aic.behavior/0.1"
  },
  "evidence_level": "executed",
  "findings": [],
  "generated_at": "2026-08-29T00:00:00.000Z",
  "observations_digest": "sha256:f11545be618f7baca84b4452bc60616f8d8151ea0938f21dadf3a5673a04bbcb",
  "proof_version": "0.1",
  "scenarios": [
    {
      "finding_count": 0,
      "parity": "passed",
      "scenario_id": "success",
      "status": "passed",
      "surfaces": [
        {
          "finding_count": 0,
          "observation_mode": "executed",
          "status": "passed",
          "surface_id": "human-ui"
        },
        {
          "finding_count": 0,
          "observation_mode": "executed",
          "status": "passed",
          "surface_id": "webmcp"
        }
      ]
    },
    {
      "finding_count": 0,
      "parity": "passed",
      "scenario_id": "authorization-denied",
      "status": "passed",
      "surfaces": [
        {
          "finding_count": 0,
          "observation_mode": "executed",
          "status": "passed",
          "surface_id": "human-ui"
        },
        {
          "finding_count": 0,
          "observation_mode": "executed",
          "status": "passed",
          "surface_id": "webmcp"
        }
      ]
    },
    {
      "finding_count": 0,
      "parity": "passed",
      "scenario_id": "confirmation-declined",
      "status": "passed",
      "surfaces": [
        {
          "finding_count": 0,
          "observation_mode": "executed",
          "status": "passed",
          "surface_id": "human-ui"
        },
        {
          "finding_count": 0,
          "observation_mode": "executed",
          "status": "passed",
          "surface_id": "webmcp"
        }
      ]
    },
    {
      "finding_count": 0,
      "parity": "passed",
      "scenario_id": "business-failure",
      "status": "passed",
      "surfaces": [
        {
          "finding_count": 0,
          "observation_mode": "executed",
          "status": "passed",
          "surface_id": "human-ui"
        },
        {
          "finding_count": 0,
          "observation_mode": "executed",
          "status": "passed",
          "surface_id": "webmcp"
        }
      ]
    },
    {
      "finding_count": 0,
      "parity": "passed",
      "scenario_id": "recovery",
      "status": "passed",
      "surfaces": [
        {
          "finding_count": 0,
          "observation_mode": "executed",
          "status": "passed",
          "surface_id": "human-ui"
        },
        {
          "finding_count": 0,
          "observation_mode": "executed",
          "status": "passed",
          "surface_id": "webmcp"
        }
      ]
    }
  ],
  "status": "passed",
  "summary": {
    "failed_scenarios": 0,
    "observations": 10,
    "passed_scenarios": 5,
    "required_observations": 10,
    "scenarios": 5
  }
}
